{
  "timestamp": "2025-05-05T05:18:21.746Z",
  "formats": {
    "text": "JOHN DOE\n\nEmail: john.doe@example.com | Phone: (123) 456-7890 | LinkedIn: https://linkedin.com/in/johndoe | Location: 123 Main Street, City, State 12345\n\nSUMMARY\n=======\nJohn Doe is a seasoned software developer specializing in the development of high-performance web applications using JavaScript, React, and Node.js. With strong expertise in AWS and CI/CD pipelines, John excels in creating scalable solutions and improving software delivery processes. A dedicated team player and mentor, John is committed to coding excellence and innovation.\n\nEXPERIENCE\n==========\n\nSenior Software Developer | ABC Company | 2020 - Present\n- Led the development and maintenance of responsive web applications using React and Node.js, improving user engagement by 30%.\n- Implemented robust CI/CD pipelines with GitHub Actions, reducing deployment time by 40%.\n- Optimized AWS deployments using Amplify, enhancing scalability and reducing costs by 20%.\n- Collaborated with cross-functional teams to deliver high-quality software on schedule.\n- Mentored junior developers, conducted code reviews, and fostered a culture of continuous improvement.\n\nSoftware Developer | XYZ Company | 2018 - 2020\n- Developed intuitive front-end applications with React, boosting overall user satisfaction by 25%.\n- Designed and developed RESTful APIs using Node.js, enhancing interoperability across systems.\n- Managed data storage solutions using MongoDB and PostgreSQL, improving data retrieval speed by 15%.\n- Actively participated in Agile development processes, contributing to a 20% increase in project delivery efficiency.\n- Collaborated on open-source projects, expanding the company's technical influence and innovation.\n\nEDUCATION\n=========\n\nBachelor of Science in Computer Science | University of Technology | 2014 - 2018\n",
    "markdown": "# John Doe\n\n[john.doe@example.com](mailto:john.doe@example.com) | (123) 456-7890 | [LinkedIn](https://linkedin.com/in/johndoe) | 123 Main Street, City, State 12345\n\n## Summary\n\nJohn Doe is a seasoned software developer specializing in the development of high-performance web applications using JavaScript, React, and Node.js. With strong expertise in AWS and CI/CD pipelines, John excels in creating scalable solutions and improving software delivery processes. A dedicated team player and mentor, John is committed to coding excellence and innovation.\n\n## Experience\n\n### Senior Software Developer\n**ABC Company** | 2020 - Present\n\n- Led the development and maintenance of responsive web applications using React and Node.js, improving user engagement by 30%.\n- Implemented robust CI/CD pipelines with GitHub Actions, reducing deployment time by 40%.\n- Optimized AWS deployments using Amplify, enhancing scalability and reducing costs by 20%.\n- Collaborated with cross-functional teams to deliver high-quality software on schedule.\n- Mentored junior developers, conducted code reviews, and fostered a culture of continuous improvement.\n\n### Software Developer\n**XYZ Company** | 2018 - 2020\n\n- Developed intuitive front-end applications with React, boosting overall user satisfaction by 25%.\n- Designed and developed RESTful APIs using Node.js, enhancing interoperability across systems.\n- Managed data storage solutions using MongoDB and PostgreSQL, improving data retrieval speed by 15%.\n- Actively participated in Agile development processes, contributing to a 20% increase in project delivery efficiency.\n- Collaborated on open-source projects, expanding the company's technical influence and innovation.\n\n## Education\n\n### Bachelor of Science in Computer Science\n**University of Technology** | 2014 - 2018\n\n",
    "json": "{\n  \"name\": \"John Doe\",\n  \"summary\": \"John Doe is a seasoned software developer specializing in the development of high-performance web applications using JavaScript, React, and Node.js. With strong expertise in AWS and CI/CD pipelines, John excels in creating scalable solutions and improving software delivery processes. A dedicated team player and mentor, John is committed to coding excellence and innovation.\",\n  \"skills\": {\n    \"technical\": [\n      \"JavaScript/TypeScript\",\n      \"React/Next.js\",\n      \"Node.js\",\n      \"AWS/Cloud Computing\",\n      \"CI/CD Pipelines\",\n      \"RESTful APIs\",\n      \"MongoDB\",\n      \"PostgreSQL\",\n      \"Git/GitHub\"\n    ],\n    \"soft\": [\n      \"Problem-solving\",\n      \"Team collaboration\",\n      \"Mentorship\"\n    ]\n  },\n  \"experience\": [\n    {\n      \"title\": \"Senior Software Developer\",\n      \"company\": \"ABC Company\",\n      \"period\": \"2020 - Present\",\n      \"responsibilities\": [\n        \"Led the development and maintenance of responsive web applications using React and Node.js, improving user engagement by 30%.\",\n        \"Implemented robust CI/CD pipelines with GitHub Actions, reducing deployment time by 40%.\",\n        \"Optimized AWS deployments using Amplify, enhancing scalability and reducing costs by 20%.\",\n        \"Collaborated with cross-functional teams to deliver high-quality software on schedule.\",\n        \"Mentored junior developers, conducted code reviews, and fostered a culture of continuous improvement.\"\n      ]\n    },\n    {\n      \"title\": \"Software Developer\",\n      \"company\": \"XYZ Company\",\n      \"period\": \"2018 - 2020\",\n      \"responsibilities\": [\n        \"Developed intuitive front-end applications with React, boosting overall user satisfaction by 25%.\",\n        \"Designed and developed RESTful APIs using Node.js, enhancing interoperability across systems.\",\n        \"Managed data storage solutions using MongoDB and PostgreSQL, improving data retrieval speed by 15%.\",\n        \"Actively participated in Agile development processes, contributing to a 20% increase in project delivery efficiency.\",\n        \"Collaborated on open-source projects, expanding the company's technical influence and innovation.\"\n      ]\n    }\n  ],\n  \"education\": [\n    {\n      \"degree\": \"Bachelor of Science in Computer Science\",\n      \"institution\": \"University of Technology\",\n      \"period\": \"2014 - 2018\",\n      \"details\": \"GPA: 3.8/4.0; Relevant coursework: Data Structures, Algorithms, Web Development, Database Systems\"\n    }\n  ],\n  \"contact\": {\n    \"email\": \"john.doe@example.com\",\n    \"phone\": \"(123) 456-7890\",\n    \"linkedin\": \"https://linkedin.com/in/johndoe\",\n    \"location\": \"123 Main Street, City, State 12345\"\n  },\n  \"certifications\": [\n    \"AWS Certified Developer - Associate\",\n    \"MongoDB Certified Developer\"\n  ],\n  \"projects\": [\n    {\n      \"name\": \"Personal Portfolio\",\n      \"description\": \"Developed a personal portfolio website using Next.js and Tailwind CSS, showcasing professional projects and technical expertise.\"\n    },\n    {\n      \"name\": \"Task Manager\",\n      \"description\": \"Created a full-stack task management application with React, Node.js, and MongoDB, streamlining task management and collaboration.\"\n    },\n    {\n      \"name\": \"Weather App\",\n      \"description\": \"Built a dynamic weather application using React and the OpenWeather API, providing real-time weather data to users.\"\n    }\n  ]\n}",
    "coverLetter": "# Cover Letter\n\nDear Hiring Manager,\n\n## Introduction\n\nI am writing to express my interest in Senior Software Developer at Your Company. With my background in my professional skills, I am confident that I would be a valuable addition to your team.\n\n## Professional Background\n\nJohn Doe is a seasoned software developer specializing in the development of high-performance web applications using JavaScript, React, and Node.js. With strong expertise in AWS and CI/CD pipelines, John excels in creating scalable solutions and improving software delivery processes. A dedicated team player and mentor, John is committed to coding excellence and innovation.\n\n## Why I'm a Great Fit\n\nThroughout my career, I have demonstrated led the development and maintenance of responsive web applications using react and node.js, improving user engagement by 30%.. I am particularly drawn to Your Company because of your reputation for innovation and excellence in the industry.\n\n## Skills and Qualifications\n\nMy key qualifications that align with this role include:\n\n- undefined\n- Technical knowledge\n- Strong communication skills\n\n## Closing\n\nI am excited about the opportunity to bring my unique skills and experience to Your Company. I would welcome the chance to discuss how my background and qualifications would be a good match for this position.\n\nThank you for your time and consideration.\n\nSincerely,\n\nJohn Doe\n"
  }
}